{
  "schema": "lonewolf.codex_native.owner_approval_record.v1",
  "build_id": "20260613_codex_native_automation_gate_contracts_v1",
  "approval_id": "approval_w2_state_gate_contracts_001",
  "task_id": "w2_state_gate_contracts",
  "approval_phrase": "APPROVE_NEXT_WAVE_DOCS_SCHEMA_TESTS_FIXTURES_IMPLEMENTATION_SIX_WINDOW",
  "approval_scope": "docs_schema_tests_fixtures_only",
  "approval_created_at": "2026-06-13T00:00:00Z",
  "approval_expires_at": "2026-06-14T00:00:00Z",
  "artifact_sha256": "AAAAAAAAAAAAAAAAAAAAAAAAAAAAAAAAAAAAAAAAAAAAAAAAAAAAAAAAAAAAAAAA",
  "owner_review_required": true,
  "execution_allowed": false,
  "runtime_allowed": false,
  "automatic_continuation_allowed": false,
  "human_review_one_point": "Confirm this approval remains scoped to docs/schema/tests/fixtures only."
}
